ratingID,userID,placeID,rating,food_rating,service_rating,comments
0,1001,135040,3,3,3,"I mean really, how do you get so famous for your fish and chips when it's so terrible!?!"
1,1001,135033,3,3,3,It's too bad the food is so damn generic.
2,1001,135045,3,3,3,We are so glad we found this place.
3,1001,135025,4,4,4,I'll take my business dinner dollars elsewhere.
4,1001,135051,3,3,4,It also took her forever to bring us the check when we asked for it.
5,1001,135085,2,3,3,"Not to mention the combination of pears, almonds and bacon is a big winner!"
6,1001,135039,3,3,3,It was pretty gross!
7,1001,132825,4,4,3,"In summary, this was a largely disappointing dining experience."
8,1002,135085,3,3,3,Great brunch spot.
9,1002,135052,3,3,3,"Our server was very nice, and even though he looked a little overwhelmed with all of our needs, he stayed professional and friendly until the end."
10,1002,135059,3,4,3,We walked away stuffed and happy about our first Vegas buffet experience.
11,1002,135041,4,3,2,By this time our side of the restaurant was almost empty so there was no excuse.
12,1002,132862,4,4,4,Their steaks are 100% recommended!
13,1002,135106,3,3,3,What happened next was pretty....off putting.
14,1002,135062,3,4,3,"Our waiter was very attentive, friendly, and informative."
15,1002,132825,4,4,2,We made the drive all the way from North Scottsdale... and I was not one bit disappointed!
16,1003,132862,3,4,4,This is the place where I first had pho and it was amazing!!
17,1003,135079,4,4,4,"This place is a jewel in Las Vegas, and exactly what I've been hoping to find in nearly ten years living here."
18,1003,135041,2,3,3,Service is also cute.
19,1003,135059,4,4,4,I promise they won't disappoint.
20,1003,135080,4,3,4,We'll never go again.
21,1003,135064,2,2,2,TOTAL WASTE OF TIME.
22,1003,132755,4,4,3,It was delicious!!!
23,1003,135075,4,4,4,All I have to say is the food was amazing!!!
24,1003,132754,4,4,4,Ordered burger rare came in we'll done.
25,1003,132825,4,4,3,"like the other reviewer said ""you couldn't pay me to eat at this place again."""
26,1003,132937,4,4,3,"The food was delicious, our bartender was attentive and personable AND we got a great deal!"
27,1004,135028,4,4,4,The bathrooms are clean and the place itself is well decorated.
28,1004,135062,4,4,3,I won't try going back there even if it's empty.
29,1004,135032,4,4,4,"Not much flavor to them, and very poorly constructed."
30,1004,135106,4,4,4,We aren't ones to make a scene at restaurants but I just don't get it...definitely lost the love after this one!
31,1004,135060,3,3,3,"One nice thing was that they added gratuity on the bill since our party was larger than 6 or 8, and they didn't expect more tip than that."
32,1004,132955,4,4,4,Nargile - I think you are great.
33,1004,132958,4,4,4,The Buffet at Bellagio was far from what I anticipated.
34,1004,132954,4,4,4,I've had better bagels from the grocery store.
35,1005,135032,4,3,4,I swung in to give them a try but was deeply disappointed.
36,1005,135076,4,4,3,Pretty good beer selection too.
37,1005,135042,4,3,4,Great Pizza and Salads!
38,1005,135057,3,4,3,The manager was the worst.
39,1005,135041,3,3,3,We've have gotten a much better service from the pizza place next door than the services we received from this restaurant.
40,1005,135066,4,3,3,Food arrived quickly!
41,1005,135050,3,4,3,Have been going since 2007 and every meal has been awesome!!
42,1005,135043,2,4,2,Which are small and not worth the price.
43,1006,135030,3,3,4,"The staff are great, the ambiance is great."
44,1006,135079,3,3,3,Spend your money elsewhere.
45,1006,135026,4,4,4,I came back today since they relocated and still not impressed.
46,1006,135075,3,3,4,"At least 40min passed in between us ordering and the food arriving, and it wasn't that busy."
47,1006,135048,3,3,4,Food was really good and I got full petty fast.
48,1006,132825,3,3,3,By far the BEST cheesecurds we have ever had!
49,1006,132954,3,3,3,The selection on the menu was great and so were the prices.
50,1007,135085,3,4,2,I dont think I will be back for a very long time.
51,1007,135032,3,3,2,"To my disbelief, each dish qualified as the worst version of these foods I have ever tasted."
52,1007,135038,3,3,2,Cooked to perfection and the service was impeccable.
53,1007,135086,2,2,2,This is a great restaurant at the Mandalay Bay.
54,1007,135025,3,3,3,"I started this review with two stars, but I'm editing it to give it only one."
55,1007,135057,3,3,4,Service was excellent and prices are pretty reasonable considering this is Vegas and located inside the Crystals shopping mall by Aria.
56,1007,135108,3,3,3,"Anyways, The food was definitely not filling at all, and for the price you pay you should expect more."
57,1007,135058,3,4,3,The steak was amazing...rge fillet relleno was the best seafood plate i have ever had!
58,1008,132866,3,3,3,I've never been more insulted or felt disrespected.
59,1008,132858,3,4,3,That's right....the red velvet cake.....ohhh this stuff is so good.
60,1008,132869,3,3,3,There is not a deal good enough that would drag me into that establishment again.
61,1008,135054,3,3,3,"Now the burgers aren't as good, the pizza which used to be amazing is doughy and flavorless."
62,1008,132854,4,4,3,Wow very spicy but delicious.
63,1008,135069,3,3,3,The chips and sals a here is amazing!!!!!!!!!!!!!!!!!!!
64,1008,135108,3,3,2,We waited an hour for what was a breakfast I could have done 100 times better at home.
65,1008,132846,3,3,3,The owners are super friendly and the staff is courteous.
66,1009,132862,4,3,4,An extensive menu provides lots of options for breakfast.
67,1009,135079,3,4,4,"seems like a good quick place to grab a bite of some familiar pub food, but do yourself a favor and look elsewhere."
68,1009,135059,4,3,3,I give it 2 thumbs down
69,1009,135063,2,2,2,I didn't know pulled pork could be soooo delicious.
70,1009,135060,3,3,3,Ample portions and good prices.
71,1009,135038,4,4,4,The food came out at a good pace.
72,1009,135058,3,3,4,"Not a weekly haunt, but definitely a place to come back to every once in a while."
73,1009,132754,3,4,3,Just as good as when I had it more than a year ago!
74,1009,135052,4,3,2,My first visit to Hiro was a delight!
75,1009,132825,3,3,2,I had to wait over 30 minutes to get my drink and longer to get 2 arepas.
76,1009,132834,4,4,3,It was way over fried.
77,1010,135065,3,3,3,"We had so much to say about the place before we walked in that he expected it to be amazing, but was quickly disappointed."
78,1010,135076,3,4,4,Restaurant is always full but never a wait.
79,1010,135042,4,4,4,"I loved the grilled pizza, reminded me of legit Italian pizza."
80,1010,135053,3,3,3,I liked the patio and the service was outstanding.
81,1010,135079,2,2,2,My fella got the huevos rancheros and they didn't look too appealing.
82,1010,135064,2,4,2,"Very good food, great atmosphere.1"
83,1010,135047,3,3,3,I'm not eating here!
84,1010,135058,3,2,2,The place was not clean and the food oh so stale!
85,1012,134983,4,4,4,Kids pizza is always a hit too with lots of great side dish options for the kiddos!
86,1012,135001,3,3,4,"This isn't a small family restaurant, this is a fine dining establishment."
87,1012,135018,4,4,4,"Overall, I was very disappointed with the quality of food at Bouchon."
88,1012,134996,4,4,4,"I have been in more than a few bars in Vegas, and do not ever recall being charged for tap water."
89,1012,134986,4,4,4,Overall I wasn't very impressed with Noca.
90,1013,135076,3,3,2,"The wontons were thin, not thick and chewy, almost melt in your mouth."
91,1013,135079,3,3,3,Hands down my favorite Italian restaurant!
92,1013,135060,3,3,2,After two I felt disgusting.
93,1013,132951,4,4,4,Their rotating beers on tap is also a highlight of this place.
94,1013,135075,4,4,3,This place deserves one star and 90% has to do with the food.
95,1013,135085,3,4,2,Penne vodka excellent!
96,1013,135072,4,3,3,!....THE OWNERS REALLY REALLY need to quit being soooooo cheap let them wrap my freaking sandwich in two papers not one!
97,1014,135082,2,2,2,We sat another ten minutes and finally gave up and left.
98,1014,135070,4,4,4,The food is good.
99,1014,135069,3,2,3,Couldn't ask for a more satisfying meal.
100,1014,135076,3,4,3,I was VERY disappointed!!
101,1014,135042,3,3,2,My husband said she was very rude... did not even apologize for the bad food or anything.
102,1014,135057,3,2,4,Our server was very nice and attentive as were the other serving staff.
103,1014,135081,4,3,3,A FLY was in my apple juice.. A FLY!!!!!!!!
104,1014,135066,4,3,4,I would not recommend this place.
105,1014,135050,4,4,4,He deserves 5 stars.
106,1014,135043,3,2,2,Their chow mein is so good!
107,1015,135071,2,2,2,My fiancé and I came in the middle of the day and we were greeted and seated right away.
108,1015,132866,2,3,3,We waited for thirty minutes to be seated (although there were 8 vacant tables and we were the only folks waiting).
109,1015,132869,4,4,4,Any grandmother can make a roasted chicken better than this one.
110,1015,135054,3,3,3,Definitely not worth the $3 I paid.
111,1015,132870,2,2,3,The live music on Fridays totally blows.
112,1015,132845,3,3,3,All the bread is made in-house!
113,1016,135106,4,4,4,The turkey and roast beef were bland.
114,1016,132856,4,4,4,"The chipolte ranch dipping sause was tasteless, seemed thin and watered down with no heat."
115,1016,132862,4,4,4,The service was terrible though.
116,1016,135042,3,4,4,I ordered the Voodoo pasta and it was the first time I'd had really excellent pasta since going gluten free several years ago.
117,1016,135045,4,4,4,I love the decor with the Chinese calligraphy wall paper.
118,1016,135066,4,4,4,OMG I felt like I had never eaten Thai food until this dish.
119,1016,135060,4,4,4,"For about 10 minutes, we we're waiting for her salad when we realized that it wasn't coming any time soon."
120,1016,135051,4,4,2,We got the food and apparently they have never heard of salt and the batter on the fish was chewy.
121,1016,135052,4,4,4,"Total letdown, I would much rather just go to the Camelback Flower Shop and Cartel Coffee."
122,1016,135062,4,4,4,Ambience is perfect.
123,1016,135032,4,4,4,It kept getting worse and worse so now I'm officially done.
124,1016,135085,4,4,2,It shouldn't take 30 min for pancakes and eggs.
125,1016,132834,4,4,4,Im in AZ all the time and now have my new spot.
126,1017,134983,2,2,3,Hell no will I go back
127,1017,132768,3,3,3,"That just SCREAMS ""LEGIT"" in my book...somethat's also pretty rare here in Vegas."
128,1018,135062,2,2,3,"I probably won't be back, to be honest."
129,1018,135032,3,3,3,"Unfortunately, we must have hit the bakery on leftover day because everything we ordered was STALE."
130,1018,135082,4,4,4,"When I'm on this side of town, this will definitely be a spot I'll hit up again!"
131,1018,135069,2,3,3,Waitress was sweet and funny.
132,1018,135025,3,3,3,The only reason to eat here would be to fill up before a night of binge drinking just to get some carbs in your stomach.
133,1018,135057,3,3,2,If she had not rolled the eyes we may have stayed... Not sure if we will go back and try it again.
134,1018,135066,3,3,3,This place has a lot of promise but fails to deliver.
135,1018,135108,3,2,3,"Overall, a great experience."
136,1018,135081,3,3,3,But I don't like it.
137,1018,135043,2,2,2,The staff was very attentive.
138,1019,135079,2,2,2,"This hole in the wall has great Mexican street tacos, and friendly staff."
139,1019,135038,2,2,2,If someone orders two tacos don't' you think it may be part of customer service to ask if it is combo or ala cart?
140,1019,135062,2,2,2,My friend loved the salmon tartar.
141,1019,132856,2,2,2,Con: spotty service.
142,1019,135086,2,2,2,I probably won't be coming back here.
143,1019,135076,2,2,2,This place is way too overpriced for mediocre food.
144,1019,132834,2,2,2,Not much seafood and like 5 strings of pasta at the bottom.
145,1020,135088,3,4,2,Server did a great job handling our large rowdy table.
146,1020,134996,3,3,3,"Great Subway, in fact it's so good when you come here every other Subway will not meet your expectations."
147,1020,132768,4,4,4,"Also, the fries are without a doubt the worst fries I've ever had."
148,1022,135040,2,2,2,I would definitely recommend the wings as well as the pizza.
149,1022,135033,3,3,4,It is PERFECT for a sit-down family meal or get together with a few friends.
150,1022,135045,4,3,3,The servers are not pleasant to deal with and they don't always honor Pizza Hut coupons.
151,1022,135025,2,2,2,This is one of the better buffets that I have been to.
152,1022,135057,4,4,4,There was hardly any meat.
153,1022,135063,4,3,4,"Best Buffet in town, for the price you cannot beat it."
154,1022,135060,3,3,4,The steak and the shrimp are in my opinion the best entrees at GC.
155,1022,135038,4,3,4,I won't be back.
156,1022,135081,2,4,3,The best place to go for a tasty bowl of Pho!
157,1022,135051,4,3,3,The service was meh.
158,1022,135052,4,4,4,My husband and I ate lunch here and were very disappointed with the food and service.
159,1022,135073,4,4,4,The service was a bit lacking.
160,1022,135062,3,4,3,"No allergy warnings on the menu, and the waitress had absolutely no clue as to which meals did or did not contain peanuts."
161,1022,135032,3,3,4,Very disappointing!!!
162,1024,135039,4,4,4,Just spicy enough.. Perfect actually.
163,1024,135073,3,4,2,Weird vibe from owners.
164,1024,135032,4,4,4,Service sucks.
165,1024,135028,3,3,3,I had about two bites and refused to eat anymore.
166,1024,135027,3,4,2,Will not be back.
167,1024,135051,3,3,2,The service here leaves a lot to be desired.
168,1024,135060,3,2,4,Don't do it!!!!
169,1024,135106,3,3,3,Their regular toasted bread was equally satisfying with the occasional pats of butter... Mmmm...!
170,1024,135042,3,4,3,"This place is overpriced, not consistent with their boba, and it really is OVERPRICED!"
171,1024,135045,4,4,2,"Poor service, the waiter made me feel like I was stupid every time he came to the table."
172,1024,135030,3,3,3,Waited and waited and waited.
173,1024,135041,3,3,3,Food was great and so was the serivce!
174,1024,135038,3,3,2,"The owner used to work at Nobu, so this place is really similar for half the price."
175,1024,132825,3,3,2,"For a self proclaimed coffee cafe, I was wildly disappointed."
176,1024,132834,3,3,3,Pretty cool I would say.
177,1025,132866,4,3,4,They also now serve Indian naan bread with hummus and some spicy pine nut sauce that was out of this world.
178,1025,135028,4,3,2,"The staff is always super friendly and helpful, which is especially cool when you bring two small boys and a baby!"
179,1025,135071,4,4,4,Each day of the week they have a different deal and it's all so delicious!
180,1025,135047,3,3,3,There was a warm feeling with the service and I felt like their guest for a special treat.
181,1025,135064,4,4,4,"Back to good BBQ, lighter fare, reasonable pricing and tell the public they are back to the old ways."
182,1025,132825,2,2,2,Bland... Not a liking this place for a number of reasons and I don't want to waste time on bad reviewing.. I'll leave it at that...
183,1025,132958,3,2,2,There is so much good food in Vegas that I feel cheated for wasting an eating opportunity by going to Rice and Company.
184,1025,132846,4,4,4,The goat taco didn't skimp on the meat and wow what FLAVOR!
185,1025,132847,4,3,3,"I really do recommend this place, you can go wrong with this donut place!"
186,1026,132706,2,4,2,The waitress was friendly and happy to accomodate for vegan/veggie options.
187,1026,132654,2,2,2,As a sushi lover avoid this place by all means.
188,1027,135085,3,3,3,Good Service-check!
189,1027,135062,3,3,3,The chicken wings contained the driest chicken meat I have ever eaten.
190,1027,132951,3,3,3,"I always order from the vegetarian menu during dinner, which has a wide array of options to choose from."
191,1027,135066,2,2,2,I'm not sure how long we stood there but it was long enough for me to begin to feel awkwardly out of place.
192,1027,135052,3,3,3,Pricing is a bit of a concern at Mellow Mushroom.
193,1027,135042,3,3,3,I will be back many times soon.
194,1027,132937,3,3,3,We will not be coming back.
195,1028,132732,3,3,3,"It's like a really sexy party in your mouth, where you're outrageously flirting with the hottest person at the party."
196,1028,132613,4,4,4,The Greek dressing was very creamy and flavorful.
197,1028,132630,4,4,4,The bus boy on the other hand was so rude.
198,1029,132862,3,3,3,"Be sure to order dessert, even if you need to pack it to-go - the tiramisu and cannoli are both to die for."
199,1029,135059,4,3,3,This is an Outstanding little restaurant with some of the Best Food I have ever tasted.
200,1029,135047,3,3,3,definitely will come back here again.
201,1029,132754,2,2,2,"I go to far too many places and I've never seen any restaurant that serves a 1 egg breakfast, especially for $4.00."
202,1029,135085,3,3,3,the potatoes were great and so was the biscuit.
203,1029,132825,3,3,2,Everything was fresh and delicious!
204,1029,132834,2,3,2,Disappointing experience.
205,1029,132937,3,3,3,"They have horrible attitudes towards customers, and talk down to each one when customers don't enjoy their food."
206,1030,134996,2,2,2,My boyfriend tried the Mediterranean Chicken Salad and fell in love.
207,1030,135016,2,2,2,very slow at seating even with reservation.
208,1030,134986,4,4,4,Great food and awesome service!
209,1030,135088,3,2,3,"He was extremely rude and really, there are so many other restaurants I would love to dine at during a weekend in Vegas."
210,1030,135018,4,4,4,"Anyway, this FS restaurant has a wonderful breakfast/lunch."
211,1030,132767,2,2,2,We won't be going back anytime soon!
212,1030,135019,2,2,2,"The burger... I got the ""Gold Standard"" a $17 burger and was kind of disappointed."
213,1032,132856,3,3,2,This was like the final blow!
214,1032,135042,2,3,2,I left with a stomach ache and felt sick the rest of the day.
215,1032,135079,4,4,2,The price is reasonable and the service is great.
216,1032,135060,3,3,3,And the red curry had so much bamboo shoots and wasn't very tasty to me.
217,1032,135038,3,3,2,I have never had such bland food which surprised me considering the article we read focused so much on their spices and flavor.
218,1032,135058,4,3,2,I don't think we'll be going back anytime soon.
219,1032,135032,2,2,2,I can take a little bad service but the food sucks.
220,1032,135085,3,3,3,"I could barely stomach the meal, but didn't complain because it was a business lunch."
221,1032,132834,3,3,2,"Took an hour to get our food only 4 tables in restaurant my food was Luke warm, Our sever was running around like he was totally overwhelmed."
222,1033,135065,3,3,3,"Lobster Bisque, Bussell Sprouts, Risotto, Filet ALL needed salt and pepper..and of course there is none at the tables."
223,1033,135030,4,3,3,Service is perfect and the family atmosphere is nice to see.
224,1033,135046,4,3,3,"Similarly, the delivery man did not say a word of apology when our food was 45 minutes late."
225,1033,135038,3,3,3,Service was slow and not attentive.
226,1033,132951,4,3,2,I hope this place sticks around.
227,1033,135075,4,3,2,My drink was never empty and he made some really great menu suggestions.
228,1033,135028,4,3,3,High-quality chicken on the chicken Caesar salad.
229,1033,135085,4,4,4,this was a different cut than the piece the other day but still wonderful and tender s well as well flavored.
230,1033,135045,4,3,4,Once you get inside you'll be impressed with the place.
231,1034,135086,3,3,3,"Same evening, him and I are both drastically sick."
232,1034,135055,2,2,2,We had 7 at our table and the service was pretty fast.
233,1034,135035,3,3,3,The only redeeming quality of the restaurant was that it was very inexpensive.
234,1034,135049,2,2,2,This place is disgusting!
235,1035,135000,4,4,4,Would not go back.
236,1035,135018,3,4,3,"Give it a try, you will be happy you did."
237,1035,132773,4,3,4,I love this place.
238,1035,134996,4,3,4,Ordered an appetizer and took 40 minutes and then the pizza another 10 minutes.
239,1035,134986,4,4,4,This place lacked style!!
240,1035,132583,3,2,4,"Anyway, I do not think i will go back there."
241,1036,135065,2,2,2,I believe that this place is a great stop for those with a huge belly and hankering for sushi.
242,1036,135042,4,4,4,"The burger is good beef, cooked just right."
243,1036,135045,4,4,4,I don't have to be an accountant to know I'm getting screwed!
244,1036,135025,4,4,4,Great place to have a couple drinks and watch any and all sporting events as the walls are covered with TV's.
245,1036,135079,4,4,4,Seafood was limited to boiled shrimp and crab legs but the crab legs definitely did not taste fresh.
246,1036,135059,4,4,4,Fantastic food!
247,1036,135064,4,4,3,"It was either too cold, not enough flavor or just bad."
248,1036,135052,4,4,4,This place is great!!!!!!!!!!!!!!
249,1036,132754,4,4,4,This was my first time and I can't wait until the next.
250,1036,135085,4,4,4,Never had anything to complain about here.
251,1036,132825,4,4,4,I had the chicken Pho and it tasted very bland.
252,1036,132834,3,4,4,Only Pros : Large seating area/ Nice bar area/ Great simple drink menu/ The BEST brick oven pizza with homemade dough!
253,1037,135071,3,2,2,"I have eaten here multiple times, and each time the food was delicious."
254,1037,135082,2,2,2,Waitress was good though!
255,1037,135070,2,2,2,"The burger had absolutely no flavor - the meat itself was totally bland, the burger was overcooked and there was no charcoal flavor."
256,1037,132854,3,4,2,This place is amazing!
257,1037,135054,4,3,3,I went to Bachi Burger on a friend's recommendation and was not disappointed.
258,1037,132869,3,3,4,The food wasn't good.
259,1037,135108,4,4,4,"I had strawberry tea, which was good."
260,1037,132845,2,2,2,The food was terrible.
261,1037,132847,3,3,3,I seriously cannot believe that the owner has so many unexperienced employees that all are running around like chickens with their heads cut off.
262,1038,132854,3,4,4,The feel of the dining room was more college cooking course than high class dining and the service was slow at best.
263,1038,132856,2,3,3,"As much as I'd like to go back, I can't get passed the atrocious service and will never return."
264,1038,132862,4,4,4,Left very frustrated.
265,1038,132858,2,4,3,"What SHOULD have been a hilarious, yummy Christmas Eve dinner to remember was the biggest fail of the entire trip for us."
266,1038,132861,3,3,4,Do yourself a favor and stay away from this dish.
267,1040,134999,3,3,3,I will continue to come here on ladies night andddd date night ... highly recommend this place to anyone who is in the area.
268,1040,132773,3,3,3,"The deal included 5 tastings and 2 drinks, and Jeff went above and beyond what we expected."
269,1040,135013,4,4,4,Everyone is treated equally special.
270,1040,135019,3,4,3,The restaurant atmosphere was exquisite.
271,1041,134983,4,4,4,I was so insulted.
272,1041,134992,4,4,4,"The menu is always changing, food quality is going down & service is extremely slow."
273,1041,135001,3,3,3,Do not waste your money here!
274,1041,135021,4,4,4,We recently witnessed her poor quality of management towards other guests as well.
275,1041,132768,4,4,3,"I do love sushi, but I found Kabuki to be over-priced, over-hip and under-services."
276,1042,135021,3,4,2,This place receives stars for their APPETIZERS!!!
277,1042,134996,4,4,4,Total brunch fail.
278,1042,134986,4,4,4,It was a pale color instead of nice and char and has NO flavor.
279,1042,134992,3,4,3,I wasn't really impressed with Strip Steak.
280,1042,132768,4,4,3,"We got sitting fairly fast, but, ended up waiting 40 minutes just to place our order, another 30 minutes before the food arrived."
281,1043,132732,3,3,3,But I definitely would not eat here again.
282,1043,132609,3,4,3,Service was very prompt.
283,1043,132608,3,3,3,The vanilla ice cream was creamy and smooth while the profiterole (choux) pastry was fresh enough.
284,1043,132630,3,3,3,Worst food/service I've had in a while.
285,1043,132613,3,3,3,"Phenomenal food, service and ambiance."
286,1044,135088,4,4,4,"That said, our mouths and bellies were still quite pleased."
287,1044,134986,4,4,4,The jalapeno bacon is soooo good.
288,1044,134987,2,2,2,"The chains, which I'm no fan of, beat this place easily."
289,1044,132583,3,4,3,The fried rice was dry as well.
290,1044,132768,4,4,4,The service was poor and thats being nice.
291,1045,135064,2,2,2,The real disappointment was our waiter.
292,1045,135051,4,4,4,Gave up trying to eat any of the crust (teeth still sore).
293,1045,135052,3,4,4,The staff are also very friendly and efficient.
294,1045,135032,2,2,2,We won't be going back.
295,1045,135085,4,4,4,The Heart Attack Grill in downtown Vegas is an absolutely flat-lined excuse for a restaurant.
296,1045,135060,4,4,4,So don't go there if you are looking for good food...
297,1045,135041,3,4,3,"Overall, I don't think that I would take my parents to this place again because they made most of the similar complaints that I silently felt too."
298,1045,132856,3,4,4,"The shower area is outside so you can only rinse, not take a full shower, unless you don't mind being nude for everyone to see!"
299,1045,132825,4,3,3,"Good food , good service ."
300,1045,132834,3,3,3,"On the good side, the staff was genuinely pleasant and enthusiastic - a real treat."
301,1046,135058,4,4,3,"The chicken I got was definitely reheated and was only ok, the wedges were cold and soggy."
302,1046,135085,3,4,3,You won't be disappointed.
303,1046,132861,3,4,4,"Frozen pucks of disgust, with some of the worst people behind the register."
304,1046,135044,3,3,2,A great touch.
305,1046,135026,3,2,4,Pretty awesome place.
306,1046,132951,3,3,4,"I personally love the hummus, pita, baklava, falafels and Baba Ganoush (it's amazing what they do with eggplant!)."
307,1046,135065,4,4,4,I can say that the desserts were yummy.
