ratingID,userID,placeID,rating,food_rating,service_rating,comments
951,1135,135032,2,2,2,They dropped more than the ball.
952,1135,135028,2,2,2,"Needless to say, we will never be back here again."
953,1135,135085,2,2,2,I consider this theft.
954,1135,132825,2,2,2,Join the club and get awesome offers via email.
955,1135,132834,2,2,2,When I received my Pita it was huge it did have a lot of meat in it so thumbs up there.
956,1136,135072,3,3,3,When my mom and I got home she immediately got sick and she only had a few bites of salad.
957,1136,132862,4,4,4,Mediocre food.
958,1136,135046,4,4,4,Not my thing.
959,1136,135055,4,4,4,The service was extremely slow.
960,1136,135074,3,3,4,"Very, very sad."
961,1136,135064,3,3,3,"I kept looking at the time and it had soon become 35 minutes, yet still no food."
962,1136,135048,3,4,4,After I pulled up my car I waited for another 15 minutes before being acknowledged.
963,1136,135028,4,4,4,We ordered the duck rare and it was pink and tender on the inside with a nice char on the outside.
964,1136,132958,4,4,4,An excellent new restaurant by an experienced Frenchman.
965,1137,132862,4,4,4,They know how to make them here.
966,1137,135042,4,4,4,I asked multiple times for the wine list and after some time of being ignored I went to the hostess and got one myself.
967,1137,135059,4,2,4,We won't be returning.
968,1137,132951,4,4,4,"If you want healthy authentic or ethic food, try this place."
969,1137,135085,4,3,4,Waitress was a little slow in service.
970,1137,135058,2,4,4,"There is really nothing for me at postinos, hope your experience is better"
971,1137,135062,4,4,4,Best breakfast buffet!!!
972,1137,135075,4,4,4,Update.....went back for a second time and it was still just as amazing
973,1137,135049,4,4,4,First - the bathrooms at this location were dirty- Seat covers were not replenished & just plain yucky!!!
974,1137,132755,4,4,4,I love the Pho and the spring rolls oh so yummy you have to try.
975,1137,132825,4,4,3,"Come hungry, leave happy and stuffed!"
976,1137,132834,4,4,4,"They could serve it with just the vinaigrette and it may make for a better overall dish, but it was still very good."
